{
  "name": "dreamlake-tasks",
  "description": "Design and operate DreamLake task folders, subtasks, waterfall and status views, progress events and linked Notes for prompts, comments, details and acceptance. Use for DreamLake task tracking inside a Project, not for execution scheduling; check the installed CLI and the target server before every operation.",
  "requires": [
    "dreamlake-cli"
  ],
  "docs": [
    "https://cli.dreamlake.ai/tasks",
    "https://cli.dreamlake.ai/projects",
    "https://cli.dreamlake.ai/dev/notes/task-session-scope"
  ],
  "tools": null
}
