{
  "name": "dreamlake-cli",
  "description": "Install and log in to the DreamLake CLI, pick an environment, upload and download data, browse or upload Sources, grant Project access, move whole Projects, transfer ownership, link writes to agent sessions, manage Vault, register UDFs, push workflows; routes compute and domain work elsewhere.",
  "requires": [],
  "docs": [
    "https://cli.dreamlake.ai/",
    "https://cli.dreamlake.ai/agents",
    "https://cli.dreamlake.ai/analytics",
    "https://cli.dreamlake.ai/artifacts",
    "https://cli.dreamlake.ai/bound-execution",
    "https://cli.dreamlake.ai/collections",
    "https://cli.dreamlake.ai/command-reference",
    "https://cli.dreamlake.ai/dev/notes/npm-publication",
    "https://cli.dreamlake.ai/dev/notes/queue-mount-release",
    "https://cli.dreamlake.ai/dev/notes/task-session-scope",
    "https://cli.dreamlake.ai/downloading",
    "https://cli.dreamlake.ai/dreamrc",
    "https://cli.dreamlake.ai/dreamrc/visualization",
    "https://cli.dreamlake.ai/environments",
    "https://cli.dreamlake.ai/experiments",
    "https://cli.dreamlake.ai/installation",
    "https://cli.dreamlake.ai/layout",
    "https://cli.dreamlake.ai/machine-auth",
    "https://cli.dreamlake.ai/notes",
    "https://cli.dreamlake.ai/notes/attachments",
    "https://cli.dreamlake.ai/notes/collaboration",
    "https://cli.dreamlake.ai/notes/columns",
    "https://cli.dreamlake.ai/notes/deletion",
    "https://cli.dreamlake.ai/notes/editing",
    "https://cli.dreamlake.ai/notes/getting-started",
    "https://cli.dreamlake.ai/notes/legacy",
    "https://cli.dreamlake.ai/notes/projects",
    "https://cli.dreamlake.ai/notes/reading",
    "https://cli.dreamlake.ai/notes/rich-content",
    "https://cli.dreamlake.ai/notes/sharing",
    "https://cli.dreamlake.ai/notes/suggest-diff",
    "https://cli.dreamlake.ai/notes/transfers",
    "https://cli.dreamlake.ai/notes/versions",
    "https://cli.dreamlake.ai/notes/videos",
    "https://cli.dreamlake.ai/organizations",
    "https://cli.dreamlake.ai/ownership",
    "https://cli.dreamlake.ai/pipelines",
    "https://cli.dreamlake.ai/projects",
    "https://cli.dreamlake.ai/provider-lifecycle",
    "https://cli.dreamlake.ai/quick-start",
    "https://cli.dreamlake.ai/registered-udf",
    "https://cli.dreamlake.ai/release-notes",
    "https://cli.dreamlake.ai/runnable-api",
    "https://cli.dreamlake.ai/runnable-upload",
    "https://cli.dreamlake.ai/scenes",
    "https://cli.dreamlake.ai/sessions",
    "https://cli.dreamlake.ai/skills",
    "https://cli.dreamlake.ai/snapshot-launch",
    "https://cli.dreamlake.ai/sources",
    "https://cli.dreamlake.ai/ssh-sync",
    "https://cli.dreamlake.ai/tasks",
    "https://cli.dreamlake.ai/teams",
    "https://cli.dreamlake.ai/uploading",
    "https://cli.dreamlake.ai/vault-cloud",
    "https://cli.dreamlake.ai/vault-kms",
    "https://cli.dreamlake.ai/vault-operations",
    "https://cli.dreamlake.ai/vault-passwords",
    "https://cli.dreamlake.ai/vault-terraform-state",
    "https://cli.dreamlake.ai/vault-write-recovery",
    "https://cli.dreamlake.ai/workflows"
  ],
  "tools": null
}
